[
  {
    "path": "SingletonLock",
    "state": "value",
    "unavailable_reason": null,
    "node_type": "symlink",
    "file_kind": "liveness_evidence",
    "selection_tier": "tier_1",
    "copied": false,
    "unclassified": false,
    "size": 9,
    "mtime_ns": "1770000000000000000",
    "hash_algorithm": "sha-256",
    "sha256": "7cb5daa78c7dd481fc843627198ac1d63759e0f2079115d5b3bcc0b2ff70315a",
    "link_target": "host-1234"
  },
  {
    "path": "Default/Mystery \"quoted\".bin",
    "state": "value",
    "unavailable_reason": null,
    "node_type": "file",
    "file_kind": "unclassified",
    "selection_tier": "unclassified",
    "copied": false,
    "unclassified": true,
    "size": 7,
    "mtime_ns": "1770000000000000002",
    "hash_algorithm": "sha-256",
    "sha256": "4f0d9e5f2d159c8bd63247f9470d09f15e1ff431cb88d5a101df49c4c01882e6",
    "link_target": null
  },
  {
    "path": "Profile 1/History",
    "state": "value",
    "unavailable_reason": null,
    "node_type": "file",
    "file_kind": "database",
    "selection_tier": "tier_1",
    "copied": true,
    "unclassified": false,
    "size": 16,
    "mtime_ns": "1770000000000000001",
    "hash_algorithm": "sha-256",
    "sha256": "3e8822f86c8854cc037e00c7a36045d4bce8cd8b765fa639ac17fefcb601c3d0",
    "link_target": null
  },
  {
    "path": "Default/Bookmarks",
    "state": "absent",
    "unavailable_reason": null,
    "node_type": "absent",
    "file_kind": "json",
    "selection_tier": "tier_1",
    "copied": false,
    "unclassified": false,
    "size": null,
    "mtime_ns": null,
    "hash_algorithm": "sha-256",
    "sha256": "5ad38304b535c2987dbd24657c1a11b884984ff600d9f389deb0d4e634fee792",
    "link_target": null
  },
  {
    "path": "Default/évidence<&>.txt",
    "state": "value",
    "unavailable_reason": null,
    "node_type": "file",
    "file_kind": "unclassified",
    "selection_tier": "unclassified",
    "copied": false,
    "unclassified": true,
    "size": 3,
    "mtime_ns": "1770000000000000004",
    "hash_algorithm": "sha-256",
    "sha256": "ba7816bf8f01cfea414140de5dae2223b00361a396177a9cb410ff61f20015ad",
    "link_target": null
  },
  {
    "path": "Odd",
    "state": "value",
    "unavailable_reason": null,
    "node_type": "dir",
    "file_kind": "directory",
    "selection_tier": "unclassified",
    "copied": false,
    "unclassified": true,
    "size": null,
    "mtime_ns": "1770000000000000003",
    "hash_algorithm": "sha-256",
    "sha256": "2b64c6d9afd8a34ed0dbf35f7de171a8825a50d9f42f05e98fe2b1addf00ab44",
    "link_target": null
  }
]
